Original,Paraphrased
"[""while in there i had the brain wave that the shower drain wasn't clearing too well that morning, 'i'll stick some of the shower un-blocker down it' i thought to myself being the diligent newly wed husband that i try to be, that'll earn me some brownie points for sure."", ""you're good people.""]","['I thought to myself, ""I\'ll use some shower unblocker to clear the clog,"" hoping to score some brownie points as a diligent and thoughtful newlywed husband.', ""'be a man gentlemanmetalhead' i thought to myself imagining mufasa's image appearing in the cloud of gas.""]"
"['while my mom was looking for parking, i showed him my sweet knife and started waving it around like a sword and then he decided it that it was his turn to play with it, but i disagreed.', 'he was physically stronger than me so i started waving it again trying to scare him off in a jokish manner but instead i ended up slicing up his arm somehow.', ""i grabbed as many towels as i could then before i went looking for my mom, i offered him my savings so he wouldn't tell our parents what really happened and he accepted."", 'my mom took him to the hospital and he ended up getting about 15 stitches if i remember correctly.']","['While my mom was searching for a parking spot, I exhibited my sweet knife to my companion and playfully waved it around like a sword, which caught his attention and he expressed interest in playing with it, but I was not ready to let go of it.', 'As he was physically stronger than me, I attempted to scare him off playfully by waving my arm, but unfortunately, I accidentally sliced his arm instead.', 'I quickly gathered as many towels as I could before searching for my mother, and I generously offered my savings to the person in exchange for their silence about the true events, and they accepted my proposal.', 'My mother took him to the hospital, where he received approximately 15 stitches, as I recall.']"
"['long story short, the toy car made its way down the drain pipe and into the sewers in just a couple of hours without me having a clue.', ""it blocked half of the neighborhood's sewer system and, as a result, anyone who lived or worked in the basements and on the ground level floors of pretty much every building on the block was in for a nasty surprise the day after."", 'somehow, i managed to keep my cool and nobody found out it was me who caused around €150,000 in damages.', 'as soon as word got out that a blue toy car had caused all of this, they knew it was me who did it.']","['there are even warnings in public restrooms about flushing paper down the drain as even that could block the whole sewer system.', ""The blockage affected half of the neighborhood's sewer system, causing unpleasant surprises for residents and workers on the lower floors of buildings the following day."", 'a brown, smelly and full of shit surprise.', 'Despite the chaos I caused, I managed to maintain my composure and keep my involvement a secret, with no one discovering that I was responsible for the approximately €150,000 in damages.', 'except my parents, of course.', 'obviously, they were furious at me, but they never ratted me out, though and just left the whole thing be.']"
"['when opening the door, i managed to hit it into the wall and hit the broom and the aforementioned scraper.', 'turns out, the scraper fell and the handle landed right in the fucking hold for the door, baring it like they do with chairs in the movies.']","['so, our store room has carpet (fuck knows, but important to the story) and behind the door we keep the broom and the scraper (thing used for getting stickers and gum off the floor).', 'when the door closed, the broom and scraper fall.']"
"['being poor and in college, i decided to bring all of my laundry home to do for free.', 'i appreciate your help.""', ""i didn't change my compression shorts for three days and waited to seek medical attention once my heat rash started smelling like a rotten corpse, and i am paying the price."", ""don't wear the same underwear for three days.""]","['""Thank you for your assistance.""', 'oh, and also: i had to do **all** of my laundry again, because nothing my crotch has touched in the past week can be worn again, else the fungus may not go away for quite some time.', 'and in case you\'re wondering, i am now popularly referred to amongst my friends as any of the following: ""mushroom dick, fungus balls,"" or my personal favorite, ""fungal nuts.""', 'Avoid wearing the same undergarments for an extended period of time, such as three days.']"
"['this happened last night in nyc.', ""my friends and i (a bunch of girls) were out, and as the night drew to a close, we decided to all hop in a cab to where our friends were staying in midtown, to drop them off before heading to one of the other girls' apartments in brooklyn."", 'when we finally pulled off the freeway, we were driving down a quiet street and my friend suddenly opened up the door while we were moving, got out, and ran away.', 'what would have been a 3 mile ride turned into 7 miles.']","[""i've been stressed trying to figure out what to do and what may happen as a result of last night's little incident."", 'my friend insisted that the 2 of us just get back into the car to go to her place, which made for an awkward moment as i got back in and we gave him her address.', ""i was more concerned with how far off we were, being 2 girls in the middle of the night, and didn't want to anger him, so i quietly mentioned that i would pay to her - he probably overheard.""]"
"['we made reservations for 7pm and got to the restaurant a little early.', 'my mom and i apologized to the manager and the waitress twice personally and had to explain that they were just drunk and making a scene and he apologized for fucking the meal up.']","['""My mother and I apologized to the manager and waitress on two separate occasions for our behavior, and we explained that we were intoxicated and regretted causing a scene.', 'The manager also apologized for the mistakes made with our order.""']"
"['so they prompt for my resume, i pop open the file explorer, navigate to my desktop, and there it is.', 'looks like this particular opportunity is out of the picture now.']","['i *also* have a picture of myself (just my head and shoulders, smiling at the camera), which is titled with my full name as well.', 'They ask for my resume, so I quickly open my file explorer, navigate to my desktop, and voila!']"
"[""**this is not directly about defecation so i wasn't sure if i should save it for the weekend, please let me know if i should!"", 'there is none left.']","['""I have a topic in mind that\'s not related to bathroom activities, so I wasn\'t sure if it\'s appropriate to discuss it over the weekend.', 'and that is how past me fucked over present me, and i am now sitting in a bathroom with no toilet paper five minutes before class begins.']"
"['so i was at kbq restaurant with some friends and went to the washrooms, the washrooms are all individual rooms with a toilet and sink inside to give privacy (it was a co-ed washroom, no urinals).', 'so while peeing standing up i was trying to fix my hair with my free hand and accidentally knocked my glasses off my head, and it fell into the toilet.']","['I visited KBQ Restaurant with some friends and used the restroom, which consisted of individual rooms with a toilet and sink for privacy, and it was a co-ed restroom without urinals.', 'While urinating standing up, I attempted to arrange my hair with one hand and unintentionally knocked my glasses off my head, causing them to fall into the toilet.']"
"['j goes to find our other friend, n, while his girlfriend s walks with me to my locker to get something for our project.', '""you know j\'s mom died from cancer?""']","['J goes off to locate our other friend N, while his girlfriend S accompanies me to my locker to retrieve some materials for our project.', '""oh god, i sound like i have cancer!""']"
"[""i didn't know the numbers were actually the numbers used for my boss's bank account."", 'i thought those numbers linked to my own bank account.']","['i thought:\n\n""well gosh darn, the numbers on my paycheck look the same as the \'bank routing number\' and \'checking account number\', i guess i can get my money out of my account this way!""', ""I was unaware that the numbers I was working with were actually the account numbers for my boss's bank account.""]"
"[""i don't tell my parents because i didn't think anything happened and parents usually freak out over these things."", ""i just got back from college and what's stuck on the front of the fridge a letter from the school and police station saying your son was caught with a open container and they are pressing charges for a mip.""]","['I recently returned from college and found a letter on the front of the fridge from the school and police station stating that my son was caught with an open container and they are planning to press charges for underage drinking.', ""i've been home for a couple days and they haven't said shit about it so i think i'm fucked because in high school same type of shit happened when they found my weed and piece.""]"
"[""in my excitement, i signed the form in a bit of a hurry, and didn't pay much attention to what was on it other than the questions."", ""so i could either be honest on the form and take the very high risk that the company would review the form and see that i'd lied on the first form, or i could hope they didn't check for any inconsistencies and then try not to mess up the polygraph test.""]","[""honesty clearly seemed like the best option, except for that i would be submitting the form to the government through the company that was hiring me, and the initial form i'd filled out for them (and lied on) also gave the company permission to view all of my answers on the sf86."", ""i didn't have much hope for either of those scenarios, so last night after reviewing the sf86 and the original form i filled out for the company, i decided to just come clean about lying on the first form and do my best to explain myself.""]"
"[""this afternoon we see a couple people parked at the very back of the the otherwise empty pool and parking lot drinking out of red solo cups and smoking at their car, we can't see anyone at the pool itself."", 'apparently these people live in my neighborhood and i called the cops on them for being at the pool they pay hoa dues for, so now i feel like a dick.', 'part of me wants to find them and try to apologize, the rest of me realizes that would do nothing to help and i need to just learn something from this and move on.']","['so our house is across the green way from the neighborhood pool, i can stand on my porch and see the parking lot and pool.', 'This afternoon, we notice a pair of individuals parked at the far end of the parking lot, next to an empty pool, consuming beverages from red cups and smoking near their vehicle.', 'It appears that these individuals reside in my community and I reported them to the authorities for using the pool they are supposed to pay homeowners association fees for, so now I feel embarrassed and regretful.']"
"['i catch her walking by as i hear someone  and try to play it off as if i was scratching myself.', 'since it was very dark in my room at night.']","['my sister and i are in highschool, so everyone in my family knows that as a teenage male, i gotta jerk it every now and then.', ""i feel the urge coming and i decide to fap off with the door open bc i didn't think my sister would come out.""]"
"['this is the story of the first time i met my freshman year college roommate.', 'i knew i broke my collarbone.']","['This is the tale of the initial encounter I had with my first-year college roommate.', 'when i went upstairs, my whole family was talking about how ""drunk madeleine has already made a fool of herself in front of her roommate by hooking up with some random guy""... i apologized profusely, & then told them all i was going upstairs to shower.']"
"['i was doing some regular grooming with the scissors when i dropped them.', 'me thinking it was a good idea to try catch them, with the slightest grasp upon the scissors the momentum from my arm carried the scissors further and harder down, along my leg.']","['I was engaging in my usual grooming routine with the scissors when I accidentally dropped them.', ""I thought it was a good plan to try to catch the scissors, but as soon as I barely touched them, my arm's momentum caused the scissors to swing downward with more force and speed, slicing into my leg.""]"
"[""suddenly i realized that's because i was literally fucking dying because the engine was running in a closed garage and i was just breathing in carbon monoxide."", 'i managed to drag/roll myself from the car and get outside where i sat on the ground and for some reason cried a little bit.']","['I successfully extricated myself from the vehicle and emerged outside, where I collapsed onto the ground and momentarily shed some tears.', ""also, for those of you asking it's not a brand new bmw, it's an older model but she just recently bought it so the engine doesn't automatically switch off.""]"
"['the tree i leaned against  had exposed bark and, it was hot outside, and there was hot sap everywhere.', 'eventually i had to slip out of my shirt and destroy the old one to get if off the sap.']","['we had plenty of help and it was hot as hell outside.', 'after hours of unloading stuff my friend and i sat outside talking about sports and i had leaned up against a tree.']"
"['i was babysitting my sister-in-laws kids with my wife.', 'fast forward about a week and i get a call from my sister in law asking me why her two year old, who she has been struggling with potty training for a while now, is suddenly afraid of bathrooms.']","[""I and my wife were responsible for taking care of my sister-in-law's children."", ""After a week had passed, my sister-in-law called me, concerned about her two-year-old's sudden fear of bathrooms, which had developed despite her ongoing struggles with potty training.""]"
"[""i'm an english teacher in korea."", 'i was sitting on the floor with the child, a little girl, and her mom.']","['I was seated on the floor alongside the child, a young girl, and her mother.', 'apparently that hand gesture, the fist with the thumb poking between the index and middle fingers, is the korean equivalent to flipping the bird.']"
"['this wasnt some relaxed club either, this was a packed 300+ people rave night club.', ""now while i have gay friends, this really wasnt my scene, but i figured hey i'm here with this cute girl, i already paid the cover, i'll just enjoy the night and see if i can score later.""]","['i readily agreed, got dressed punched up the address she gave me and traveled 45 min to meet up with her.', ""we get out there and she was busting out some pretty decent moves and i began to think the night just might be on the upswing...until our twosome turned into a threesome with me in the middle...trust me there's no buzzkill like being humped in your ass by another dude.""]"
"['i make it to the toilet, but i miss for the entirety of the stream.', ""so there's a puddle of piss on the floor and i kick the trash can.""]","['i end up taking probably 4 shots of whiskey before (apparently) going to bed to snuggle with up my gf and sleep.', '""There is a puddle of liquid on the floor, and I am kicking the trash can to clear it.""']"
"['to make the game more interesting, you have to throw the keys up, and while they’re in the air, you have to clap below them, then clap above them, and finally catch them while they’re still in the air.', 'out come the keys, and my cousin squats down to catch them in case of a drop.', 'my first try was close, but i missed them, and they fall into his awaiting hands.', 'i turned my hand over and we see a bump on the other side, meaning the key had made it almost all the way through!']","['he grabs the keys from his pocket and starts throwing them up and down.', 'To add more excitement to the game, you should toss the keys high into the air, then clap your hands below them, followed by clapping above them, and finally catch the keys while they are still in mid-air.', 'I examined my hand and noticed a prominent bump on the other side, indicating that the key had almost fully penetrated my palm.', 'a trip to the emergency room, two doses of morphine and one hard tug later, i’m key-free.']"
"[""and of course i decided to chuck my jeans inside the washing machine without having any second thoughts about emptying my pockets (i've washed a few other earpiece in the past, however those didn't have a battery inside of them and so it wasn't on my mind to actually check for my earpiece.)"", ""i dug around hoping to find my earpiece but couldn't find it, so i was temporarily relieved and went to look for it elsewhere (in the hopes of my actually remembering to take it out).""]","['Without giving it a second thought, I tossed my jeans into the washing machine along with my earpiece, which I had worn earlier and not bothered to remove from my pocket.', ""so after a round of washing, i went to hang up the laundry for drying (i live around the tropics) and that's when i found the carrying case that came with my earpiece sticking out of my jeans.""]"
"['anyways, i hear the door to the apartment open, a roommate is home early.', 'well, shit, my underwear are on the other side of the room after a passionate throw for the the excitement of making some baby batter.']","['so i was fully naked jerking it to some good old internet porn.', 'i was edging, getting near the point of cumming, for quite a while now and was near busting.']"
"[""i took my laptop into the bathroom to play runescape and my parents get home, my dad sits in the living room (it's right next to the bathroom)."", ""worse part was explaining it to my dad and he still brings it up every time i visit...\n\n \n\nedit: i'm on mobile so excuse the formatting.""]","['I brought my laptop into the bathroom to play Runescape, and when my parents arrived home, my dad sat in the living room, which is adjacent to the bathroom.', 'The most challenging aspect was recounting it to my father, and he continues to bring it up every time I visit.']"
"['i was told less than a month into my temporary position that they wanted to keep me permanently, but i had to ride out the contract.', 'apparently hr and the woman who was my biggest mentor and one of my biggest advocates there have told the whole office that i quit.']","[""i had done tons of research that told me what was on my offer was the lowest of low ball offers for this type of position, and is usually reserved for someone with absolutely zero experience, probably an associates degree or less (i have a bachelor's and they'd already trained me for three months and proved i can do any and everything they throw at me), and that most likely i should be making a bit more."", 'i got pulled into the conference room, told that they were not accepting my counter offer and that they had decided to end my contract.']"
"[""i'd forgotten to shake it."", ""i can't believe how much milk came out of that glass.""]","['I had forgotten to give it a good shake.', 'I was amazed by the amount of milk that flowed from the glass.']"
"['after a couple of minutes my little brother decided to walk in (no evidence of what had been done was left) and asked me to play some ps3 with him.', 'i quickly realized that i forgot to close the window and screamed at him to leave, being a kid he bawled his eyes out while leaving.']","['immediately decided to ctrl + shift + n, and watch some porn.', 'A few minutes later, my younger brother entered the room and requested to play a game on our PS3 with me, leaving no trace of his previous activities.']"
"['so i was trying to take off the case to my iphone 6 to compare the color of the back with my friends phone.', 'well when i went to try and take it off, i pressed on the screen for some leverage and sure enough i heard a small crack noise and then saw a nice fat crack go down the middle of my phone.']","['when i first got the case i could tell it would be a pain to get off by how hard it was to slide on.', 'As I attempted to remove the screen protector, I pressed on the screen for better leverage, and to my dismay, I heard a small cracking sound and noticed a prominent crack running down the middle of my phone.']"
"[""he thinks the child he raised to be a saint is some kind of pimp, anyhow he takes my phone, goes on a rant about how it's school and western society that screwed me over like this, and is adamant about sending me to some religious school in pakistan for the next four months (no i'm not brown, he just has problems)."", ""so now my dad wants to send me overseas, fighting with my mum over the entir situation, and thinks i'm some kind of horny creature (couldn't be more right) all because i wanted some goddamn food.""]","['Now, my father wants to send me abroad, and he and my mother are at odds over the entire situation.', ""He thinks I'm some kind of hormonal teenager (he's not entirely wrong), all because I wanted some darn food.""]"
"['long story short no sex for me.', ""now i'm scared she might tell someone and by doing so ruin my life(ok maybe a little over exaggerated but yeah..""]","['i said ""idk maybe i\'m not sure"" and she gone apeshit about why i kissed her then and stuff and i felt pretty bad and said ""well what should i do?', ""I'm worried that she might reveal my secret and cause harm to my reputation or well-being.""]"
"['""condoms are in the drawer, i\'ll be out in a few minutes,"" she whispered, biting my ear and making my legs go weak for a moment.', 'sweaty legs.']","['sweaty palms.', 'sweaty forehead.']"
"[""during this break, one of my co-workers, we'll call him dan, had the idea that we could play a baseball game with the branches and walnuts."", 'another pitch form toni, and dan swings and the bat flies right out of his hands on a direct course to the side of my head.', ""i'm not even sure what happened or if i got hit or not."", ""i'm extremely shucking up and scared to death, my eyes are full of tears and everyone's looking at me seeing if i'm alright (except greg, he just continues to laugh).""]","['During the break, Dan, one of my colleagues, suggested we play a game of baseball using the branches and walnuts as equipment.', ""another of my co-workers, he'll be greg, cuts a roughly straight, 2 inch in diameter branch so we can use as a bat."", 'Toni throws another pitch, and Dan swings his bat with such force that it flies out of his hands and heads straight for my head.', ""I'm feeling extremely anxious and terrified, my eyes are welling up with tears, and everyone around me is looking concerned except for Greg, who is still chuckling.""]"
"['he then tossed me a canned coke soda and told me to put it on it to cool it down.', 'so i ended up with a coke and a story to tell about safety.']","['He then threw me a canned Coke and suggested I open it to cool it down.', 'I wound up with a Coke and a memorable anecdote about safety.']"
"['over the weekend she got sick with a flu bug, when someone from her work tried to call her in for an extra shift she decided on that reason.', ""problems arise about an hour ago now as she texts me telling me that she's scared for her job and feeling like shit.""]","['some background, my wife has a severe stress condition along with adrenal fatigue.', 'this leads to her having been sick for the last few months in a very intense job in the restaurant industry.']"
"['a friend and i decided to ride the length of the american tobacco trail today.', ""anyway, we get back to our car, congratulate ourselves on finishing the 44 miles (my friend never had biked more than 20 and i haven't biked that long since this summer), and we drive away as dusk turned into night."", 'we arrive at the gate and find it locked.', 'my friend gets out his phone and is looking up numbers to call and i head back to the trailhead to try to find some park office numbers.', 'i come back and he says he called the police and an officer is going to help us.', 'it also turned out to be the second number i found and texted my friend.']","['My buddy and I chose to embark on a bike ride along the entire length of the American Tobacco Trail this morning.', ""After returning to our car and congratulating ourselves on completing the 44-mile bike ride (my friend had never biked more than 20 miles before, and I hadn't biked that far since the summer), we drove away as dusk gave way to night."", 'My friend is searching for phone numbers to call on his device, while I head back to the trailhead to look for contact information from the park authorities.', 'we wait for about an hour before a cop shows up and he tells us he is working on contacting the park service as they are the only ones with the key.', 'we read the slip of paper and on it is the direct number of the parks department we should have contacted to begin with.']"
"['for those lucky ones who got out of highschool before the new days of lanschool, basically it is a (really advanced) software that is designed for teachers to have complete control over a class worth of computers (actually a network, but my school locked it to a per-port basis).', 'no, i hated the fact that at the click of a button, my teacher could lock my mouse and keyboard and put whatever she wanted on the screen.']","['fast as hell, i uploaded the entire lanschool folder to my dropbox so i could figure out what i could do with it.', 'well, i told my teacher about what i could do during a game-dev club meeting (she and i were on good terms).']"
