Original,Paraphrased
"['here is some context, i am in my last semester of college and my wife and i have three cats.', 'when he first met my other cats, they hissed and swiped at him but all he did was meow and try to get close to them.', 'so i took 3 weeks before class started waking up extra early so that waking up for class would be no problem.', 'well during this prep i would go and feed my cats, easy morning routine, no problem.']","['and then, 2 years later, we got mushu.', 'To ensure that I had plenty of time for my morning routine before classes began, I started waking up three weeks in advance, rising early each day to establish a comfortable and leisurely pace for my daily activities.', 'I would take care of my cats during my morning preparations, which involved feeding them and otherwise attending to their needs.']"
"['so i am walking down the aisle, and i see an elderly man who is staring at the wall, just kind of looking at our wall of stuff in the room he was in.', 'anywho, i decide to substitute saying, ""let me know if you need some help"" with ""let me know if you need a hand.""']","['he is facing the wall, not me.', 'I opted to replace ""let me know if you need some help"" with ""let me know if you need a hand.""']"
"['i bumped the knobs that control the burners accidentally turning on the one underneath one of the boxes and it started to burn the box.', 'luckily another person there saw the smoke and removed the box and shut off the burner.']","['Fortunately, someone else present noticed the smoke and quickly retrieved the box and turned off the burner.', 'the whole apartment was filled with smoke and even one of the neighbors came out concerned the building was on fire.']"
"[""actually happened today, so i've been an irresponsible young adult and haven't paid my water bill,in full, for the past three months."", 'so it looks like my toilet will be plagued with the foulest smelling beer shits for the next five weeks.']","[""then it hits me, i'm now in horror of my foolishness."", 'It appears that my toilet will be afflicted with extremely malodorous beer-related waste for the next five weeks.']"
"['my nose began to bleed.', 'and not going to the gym until tomorrw in fear of making it bleed again.']","['i then begin to feel a tickle on my nose and i knew this feeling too well.', ""I'm not planning to go to the gym today because I'm afraid of causing it to bleed again.""]"
"['i bike to and from school every day with my friends and today was no different.', 'i get my bike out and we go to cross the busy pick up lane when im going relatively fast.']","['I pedal to and from school with my friends on a daily basis, and today was business as usual.', 'i see the cars are moving forward very slowly and just as im about to cross the lane the traffic completely stops.']"
"[""i then started to turn the handle of the jack, asking my wife if it looked like the car was lowering, as she had a better angle to see the jack and she said she wasn't sure."", ""and by accidentally raising the jack i built up the pressure until the panel couldn't hold the weight of the car anymore via leverage and the jack punched through it and into the radiator.""]","['so when we got there i took a quick look underneath the car and saw that one of the plastic panels underneath the car to keep mud out of the engine compartment had come loose and was scraping the ground.', 'Through a series of unfortunate events, I inadvertently increased the pressure with the jack, causing the panel to buckle under the weight of the car, resulting in the jack piercing through it and damaging the radiator.']"
"['then i go the idea to prank him.', 'she broke up with him.']","['for the past 6 months, my best friend has maintained an excel doc on his laptop to keep track of every time he masturbated.', 'She ended her relationship with him.']"
"[""the other people i done it with, leroy, bilbo and jaden, were freeloaders and didn't pay a penny towards it."", ""now remember, i paid the most for it and yet i felt the least, this really fucking pissed me off but i played it off as i didn't care, we all start spraying ourselves down with deodorant so no one knows we have been smoking weed and then start making our way home after the affects wore off everyone.""]","[""as i paid the most, i took the first smoke and couldn't feel a thing, the blunt was passed around and bilbo was the first to feel it, about 2 minutes after smoking the blunt he starts giggling and kept going back for more."", '""I felt frustrated and disappointed when I paid a lot for something but didn\'t feel satisfied with the experience.']"
"['i tell the girl that i need to gtfo.', 'i texted the mom just to flirt while i\'m about to do the deed, and the conversation was like ""why\'d you leave"" and i was just hoping to get some sexy talk out of her... well i ask if she wants company.']","['it started back about a year ago with me just joking around with her, like ""someday you\'re going to wake up, and i\'m just going to be in your living room in your mom\'s bathrobe, eating honey nut cheerios like; \'hey... i fucked your mom last night\' "".', 'I let the girl know that I need to leave immediately.']"
"['when this happens we have to transfer them to the correct number.', 'now normally if i transfer a caller to the wrong number, i ask for their number, call them back and get them to the right place, but since this was a sex line, i freaked out as i am on a recorded line (i know even worse right?).']","['When this occurs, we need to reassign them to the appropriate number.', 'Typically, if I accidentally transfer a caller to the wrong number, I will ask for their number and call them back to redirect them to the appropriate destination.']"
"['so i fire up the drone in my backyard, and start showing my cousins some basic flips i can do with it.', 'as i got up to collect myself, however, i noticed there was some sort of red dye on my shorts.', 'after i had belly flopped into the river, my forearm had apparently landed on a broken beer bottle underneath the surface.', 'needless to say, my younger cousins were shocked to see me drenched and my arm covered in blood after trying to retrieve my drone.']","[""there was a slight breeze, but this little thing has some surprising motor control, so i thought it'd be fine."", 'I launch the drone in my backyard and demonstrate some fundamental aerial stunts to my cousins.', '""great, it\'s broken.""', ""After I had tumbled into the river, my forearm had come to rest on a shattered beer bottle submerged beneath the water's surface.""]"
"[""ok so i'm a student who had to create an account through a college in order to sign up for classes."", 'the account basically follows you for life.', 'went back to college page, tries activating account again.', '""account has already been activated.""']","['As a student, I had to register for an account with the college in order to enroll in classes.', ""i looked at the security questions, thought 'well i'm not gonna know any of my answers for these ever' and before i thought it through, clicked back, to get back to the first security window."", 'Returned to the college page and attempted to reactivate the account once more.', '""Your account is already active.""']"
"[""i didn't even know if i had, since all i wanted to do was reposition my lip, but i suppose my hand brushed against it."", ""i still don't know what it was, i still have no idea what it could have done, i still don't know whether it could kill me if i eat using my left hand today and it isn't all completely removed.""]","['and picks up my hand to inspect it.', 'being me, i\'m embarrassed about accidentally touching this stuff and don\'t want to ever go back, but i suppose that some more education on this ""blue dye"" and why i was abandoned with it slathered on me would have been helpful.']"
"['enter my stupidity and gullibleness... he told me that if you fired the gun right next to your ear, it would sound like a bomb.', 'it took my ear two days to recover, and my trust in this ""friend"" took even longer to recover.']","['He claimed that if you shot the gun near your ear, it would produce a sound akin to an explosion.', 'My hearing took two days to recover, while my faith in this person required even more time to mend.']"
"['my boss is a magnificent pain in the ass, and i thought i’d blow off some steam a few weeks ago by typing out some honest thoughts about her in a document i was putting together for her (it was a brief executive profile) and then erasing them before sending it.', 'my boss’ bitchometer tends to climb proportionately with the day’s workload, so it climbed to an 11 and burst into flames this morning.', 'in all of the confusion, i took a phone call mid-way through one, switched to a different project, came back a half hour later and saved and sent the document, totally thinking that i had finished it and forgetting about the shakespearean fuck you sonnet chilling in the middle of it.', 'over the last few minutes, i’ve considered everything from claiming it was some sort of virus (i work in digital media, she is the advertising director and not great with computers, i could maybe bullshit my way into convincing her that something like this exists) to sneaking into her office for a ninja delete to just being honest and apologizing and begging for mercy.']","['""I had some challenging experiences with my previous supervisor, but I tried to address them in a professional and respectful way by documenting my thoughts and then deleting them before sending the document.""', ""As the workload for the day increased, my boss's frustration level also rose proportionately, reaching a peak of 11 and resulting in a fiery outburst this morning."", 'the deed is done and there’s no undoing it.', ""Over the past few minutes, I've entertained a range of possibilities, from blaming a technical issue (as I work in digital media, she is the advertising director and not tech-savvy) to sneaking into her office to delete the evidence, to simply owning up to my mistake and pleading for leniency.""]"
"['30 seconds to go in the first half in futsal (indoor soccer) and i run out from goals because we have a corner.', 'skip to being in hospital, with me trying to keep blood out my eye.']","['With only 30 seconds remaining in the first half of our indoor soccer game, I sprint out from the goal area to prepare for a corner kick.', 'After I was injured, I rushed to the hospital, frantically trying to prevent blood from dripping into my eye.']"
"['a good friends sister moved to our city from another province and he asked me and another mutual buddy to help move her in to her place.', ""buddy who got her pregnant tells her after the abortion they are done, do she is heartbroken and doesn't know what to do.""]","['she has an instant attraction to other buddy and they start a relationship.', 'The man who impregnated her and then abandoned her after the abortion has left her devastated and uncertain about her future.']"
"['so, i decided to change my google+ name to my league of legends username.', 'today, i got paranoid (thinking that maybe i had accidentally sent something inappropriate), and decided to go check my ""sent"" inbox...\n\n\nlo and behold... i\'m greeted with my own fucking league of legends username as the sender.']","['Therefore, I opted to modify my Google+ name to match my League of Legends username.', 'little did i know that this would also change my name on gmail...\n\ncome christmas/new years, i email my employers and former professors, wishing them a happy holidays and whatnot.']"
"['pull up to gas pump, topping off to that amount.', ""get in my car, speed off because i probably looked stupid (some guy was smoking his cig on break or something and looked at me), risk ticket for going 60 mph in a 25 mph zone because my favorite sweater from sport's authority was soaked in overpriced fluids.""]","[""i drive home and realize that gas is going up again (fucking bullshit) and see that i have half a tank, might as well get it now before it's $2.50 again."", 'now, every gas station that i go to has this feature that if you have a certain amount in your bank it does not go over when topping off gas.']"
"['i was so embarrassed!', ""*(it didn't help that i was in a swimsuit & it seemed that everyone in the building decided to walk past as i was standing at the radio room doing paperwork.""]","['but with so much traffic + it seemed that the storm was coming in sooner than expected, the waves were getting higher than i was comfortable with.', ""so i tried to get back to the ramp where i'd launched.""]"
"['i was in the library studying for the hardest test of my first year of medical school.', 'i had a cup of water that i was drinking, without a lid of course, and after a sip i tried to set it back down but it slipped out of my hand and spilled all over my laptop.', 'i still had a test to study for, which was only a week away so i had to go to walmart and buy a cheap 11"" chromebook to hold me over until my replacement laptop came in the mail.', ""i had to meet with a committee where they told me that because the class was so long, that i wouldn't be able to just retake the test during the summer, which is the normal protocal for someone who fails a class, but that i'd have to repeat the entire first year.""]","['I was diligently studying for the most challenging test of my first year in medical school at the library.', 'I took a sip from my cup of water, which I was holding without a lid, and as I tried to set it back down, it slipped from my grasp and spilled all over my laptop.', ""i knew it was going to be close and when i finaly got them back, i saw that i'd failed by half of 1 percent!"", 'You were required to meet with a committee where they informed you that due to the length of the class, you would not be able to simply retake the test during the summer, as is the usual protocol for those who fail a class, but instead you would need to repeat the entire first year.']"
"['either way, i decided that it was way to late that evening to call back, and then over the weekend i figured (probably assisted by the anxiety) that it would be polite to leave her to enjoy her weekend- reasoning that nothing would change during this period regardless of what the call meant.', 'back to square one.']","['perhaps she was calling to let me know anther person got the job, or was it good news and i could have the job!', ""my dream position slipped through my hands because i was too anxious to call her back and didn't want to be a bother over her weekend.""]"
"['we had our exit strategy somewhat planned out, got our flight details in order and left the dorm at a respectable time to get to the train station, buy a bus ticket for narita (the same way we came), and fly home.', 'so we went straight to plan b, get a train ticket to the airport instead.']","['and then we discover that the terminal was at the other end of the biggest friggin station in tokyo.', 'we made it on the train literally 5 seconds before the doors closed.']"
"['my laptop was in the kitchen, and it contained all my tunes.', 'screamed the gaggle of junior high-aged kids outside my open kitchen window blinds.']","['My music library was stored on my laptop, which was surprisingly located in the kitchen.', 'since my roommates were still at school, i nipped out of my bathroom to get my laptop from the kitchen table.']"
"['trying to be the most explosive i’ve been all day (remember i thought this bar was loaded way heavier than the one i practiced on).', 'the bar was way lighter than i expected and went way higher.']","['The bar was significantly lighter than I anticipated and reached a much higher level than expected.', 'this whole thing was done infront of my entire class...']"
"[""i told them that we didn't have a gas leak, but it was my dead snake."", 'the fire crews left, the students came back to class, and i made the news.']","[""i couldn't let my students see the dead snake so i carried out of my door that went to the outside and threw it in the school dumpster."", 'I informed them that there was no gas leak, but the issue was actually my deceased pet snake.']"
"['bearing in mind this was all to impress a girl i had hardly even spoken to.', 'they have these useless pockets that always become unfurled and get in the way when doing sport.']","['well there was this girl in my class who i have had a huge crush on since year seven (6th grade), and due to the fact that i was already fairly good at running at the time and thought that i would be able to beat pretty much all of my p.e group with a little effort.', 'well anyway, my parents were called and when they were told what happened my dad laughed for like ten minutes straight before being sent away.']"
"['i find a mcdonalds cup, unzip and let it go.', 'flash forward to the next day and i jump back in my car to head to work only i notice a puddle in my cup holder.']","[""I discover a McDonald's cup, unfasten it, and release it."", ""i sit there and stare at it hoping i'm just seeing shit but nope, it's my pee, my pee is all over the center console and cup holder.""]"
"['i was going to spit into the sink but i thought it would be cool to spit out the window and watch it drop (i was on the second floor bathroom).', 'so i prepared my spit, and kind of ran towards the window and spit as i got there.', 'even as i watched, i knew that spit was directly headed for the top of somebodies head.', ""my heart was pounding, i didn't know if the teachers were going to try and find me or not, if they saw me spit."", 'yep, did that the entire way back to class and spent the entire day freaking out.']","[""still doesn't change the fact that i totally spit on a five year old though."", 'i swore all the time and spit and all that.', 'I considered spitting into the sink, but I decided it would be more exciting to spit out the window and observe it fall from the second-floor bathroom.', 'directly below my line of fire was a gaggle of excited little kids running out to play recess.', 'My pulse was racing as I anxiously wondered if the teachers would discover me or not, especially if they witnessed my spitting.', 'I repeated the task all the way back to class, and spent the entire day feeling anxious and stressed.']"
"['now my friend (who happened to have a blue parachute) had a slight malfunction and had to cut away, his reserve opened flawlessly and all was good.', ""thinking they had just witnessed their son's death, they were of course shocked and wondering why nobody was freaking out/calling 911. luckily they both know how to keep their cool when shit hits the fan (retired er doctor and retired cop) and just asked someone if i had died.""]","['all was going well, a few of my buddies and i went up in the plane and jumped.', ""Feeling that they had just witnessed their son's death, they were understandably shocked and curious as to why no one was reacting with more urgency, such as calling 911.""]"
"['so anyways 2 days ago, his dorm neighbour knocked on his room and asked if he knew what happened to the washing machine and why the water was yellow.', 'after he had put his laundry inside the washing machine, he realised that there was water inside already.']","['In other words, two days ago, his dorm neighbor came to his room and inquired about the status of the washing machine and why the water was yellow.', 'After he had added his dirty clothes to the washing machine, he noticed that there was already water inside the machine.']"
"['spent the next 30 minutes running back to each of my classrooms, then off to the lost and found.', 'well, the indicator was now below empty.. \n$70 for an empty tank of gas...']","[""as i made my way to the parking lot, i checked my pockets and suddenly realized i didn't have my jeep keys."", 'The fuel gauge had dropped below the empty mark, and the cost of filling up an empty tank was $70.']"
"[""i stayed in for a few more minutes and when i was clean, got out to notice the condom wasn't on the garbage can rim anymore."", 'maybe ten minutes into the party, my dog stops running around and squats to go poop.']","['not thinking much of it, we continued in the shower and when she was finished washing off she got out.', 'the dog, for some strange reason, walks right into the dead center of everyone at this bbq and starts pooping out this yellowish object.']"
"['gym class.', 'last few minutes of gym class.']","['we are playing indoor soccer in this ancient gym where the school holds practically any event.', ""i'm right footed in soccer.""]"
"['as we walk up to the counter i notice a purse sitting on the floor so i immediatley say \n\n""hey i think some lady left her purse here!""', 'he picked it up and first said it was his school bag, then his laptop bag.']","['""As we approach the counter, I notice a purse lying on the floor and promptly point it out, saying \'Excuse me, I believe someone left their purse here!\'""', 'He retrieved the item and initially claimed it was his school bag, before acknowledging it was actually his laptop bag.']"
"[""one man, i've already forgotten his name, says that he's a high tea consultant."", 'of course, being a tea lover, i get super excited and fire off a ton of questions about how he got the job and what his favorite tea is.']","['According to one individual whose name I cannot recall, he specializes in offering expert advice on high tea.', 'As an avid tea enthusiast, I become extremely excited and promptly pepper him with inquiries about how he landed the position and what his go-to tea flavor is.']"
"['a second later my stomach said nope and i literally shit in my pants.', 'the next day my friend approached me and he looked very distraught, he said that someone shit in the seat before him and all the kids think its him.', 'i try to comfort him while debating with myself if i should tell him or not.', 'i ask you r/tifu what should i do should i not tell and let my best friend take the fall for it or tell the truth and basically commit social suicide?']","[""nobody knows of what i did and i'm super anxious to tell someone.. anyone.. which is why im posting here today."", 'he is my best friend ever since i move to the u.s from brazil\nso its around 12:50 and i am at my last period of the day at my highschool.', 'i looked at my seat to see that the seat had chunks of poo and was dripping with my poo fluids.', '""I\'m torn between keeping quiet and letting my best friend take the blame for something, or revealing the truth and risking social ostracism.""']"
"[""checking through all the cabinets in the dark is difficult and i still don't want to turn the light on, so i stalk back to my room, grab my phone as a flash light and continue my search."", 'i turn the water on behind me and start to spoon it onto my backside, wiping with my hands and praying the soap is good.']","[""I turn on the water behind me and begin to apply it to my backside, using my hands to spread and wipe the soap, hoping it's effective."", ""standing naked and injured in front of my girlfriend's parents at 2am.""]"
"['but, an amazing thing happens to me.', ""i don't even burn my house to the ground (though i considered it)."", 'instead, i ever so calmly, without the slightest hesitation, reach over and flick this little bastard off my hand and away onto the floor.', 'so, half an hour more of being curled up in my nice warm bed, quietly congratulating myself on being a real adult and not panicking when i dealt with that spider.', 'my alarm goes, so i got up, got dressed, and started some study before i had to get ready for work in a few hours.', 'i flailed - i also fell, because i still had my jeans and underwear around my ankles, that absolute shit of a spider staring back up at me from the crotch of my knickers, so i jumped back in fright (because i was most certainly *not* expecting to see a spider where my vag had been only seconds before) and i managed to trip, hit my back and then my head on the vanity (think a lovely scraping motion against the corner as i fell) before sitting with my bare arse on the cold tiles as this spider, happy as you please, crawls back down into my jeans never to be seen again.', 'so yes - the lesson of the day, kiddos, is to *always* make sure you killed the spider.']","['I refrained from setting my home ablaze, despite momentarily entertaining the thought.', 'Therefore, I spent another half hour luxuriating in my cozy bed, proudly acknowledging my maturity for calmly dealing with the spider without freaking out.', 'When my alarm sounded, I rose from bed, put on my clothes, and began reviewing my studies before preparing for my work shift, which was due in a few hours.', 'I wildly thrashed about, lost my balance, and fell backward, landing on my back and then my head on the vanity with a scraping motion, as I was startled by a spider that had unexpectedly appeared in my underwear.', 'The spider calmly crawled back down into my jeans, never to be seen again.', '""In other words, children, it\'s crucial to ensure that you completely eliminate the spider before moving on with your day.""']"
"['i threw he kicked it he then threw i tried to kick it.', 'i kicked over my head and at that moment my left leg decided to pull out from underneath me and i subsequently fell onto the concrete tennis court hitting my right hand left wrist and my right knee it is now extremely bruised and probably fractured\n\ni now have to take my english midterm with a numb writing hand']","['I threw the ball, but it bounced back to me, so I tried to kick it instead.', 'I kicked my leg upwards, but my left leg suddenly gave out from under me, causing me to fall onto the concrete tennis court with my right hand, left wrist, and right knee taking the brunt of the impact.']"
