Original,Paraphrased
"['i proceed to raise my hand and it turns out the cupcakes were right above me.', 'i knocked the cupcakes out of her hand and they spilled  all over her.']","['I accidentally knocked the cupcakes out of her hand, causing them to spill all over her.', 'after numerous emails from my mom to the teacher things finally cleared up and all was back to normal.']"
"['so i go across past the side street and this fire truck starts veering over into my lane, which has had its width severely reduced by the cars parked along the corner in front of the pizza shop and all i can see is this huge truck flashing its lights at me as it tries to go through my lane to get into the side street, my dad pushing himself down into his seat bracing for impact and the cars parked next to me.', ""woah woah woah' in my left ear and the fire truck's sirens and horn in my right ear.""]","[""this is going to be difficult to explain without making myself look stupid, but anyway: i was driving down station street with my dad supervising in the passenger seat and we're quietly chatting about all manner of nonsense as i trundle along at about 60km/h when suddenly a fire truck comes right up behind us, sirens blaring and travelling at at least 80, so my dad explains that i should pull as far to the left as i safely can to let them through, so i cautiously guide my car into the bike lane, making sure i won't kill any cyclists in the process."", 'As I cross the street, a fire truck suddenly swerves into my lane, narrowed by parked cars in front of the pizza shop.']"
"['i thought my predicament was over, but then there was the matter of getting off at the right stop.', 'i got off at the stop that i thought was closest to mine and started walking.', ""i still had no idea where i was going, and i didn't want to use google maps because (a) my phone battery was under 10% and (b) international data usage was insanely expensive."", 'my host mother wanted to know what in the world i was doing out and about at 11 pm, and i explained that i had just gotten very, very lost.']","['the theatre was very close to our school, so i knew how to get around the area.', 'i was confused, because i suspected that i had passed my stop but i recognized some of the landmarks i was passing.', ""I was still unsure of my destination and chose not to rely on Google Maps due to my phone's low battery percentage and the high cost of international data usage."", ""i walked and walked and walked, desperately trying to remember where my host family's house was, but no matter what i did i just got more lost.""]"
"['on this day i was craving fries and gravy real bad.', 'i order my fries and immediately get the attention of the seagulls.']","['literally a tornado of seagulls started swarming me, getting about half a foot from my face.', ""obviously i'm freaking out, i'm swearing, they're all laughing, i end up throwing my tray of fries, hitting a cloud of seagulls in the process and running away as fast as i can.""]"
"['turns out my dad was at the front door talking to our super conservative stain glassed ass neighbors, whom i heard audibly gasp from the kitchen.', 'a quesadilla.']","['in my haste, i tipped the pan sideways and spilled scalding-hot ingredients all over the floor and all over my nearby dog, coating him in the searing remnants of the wonderful goodness that was once a vessel through which the culinary soul could be moved.', 'all my ingredients gone, i had to settle for a cheese quesadilla instead.']"
"[""i was in the shower last night, sat down in the tub to scrub my feet and legs with my back facing the spigot or whatever it's called."", ""oh, i forgot to mention i have gym class later and i'll surely be feeling it when we're doing stretches.""]","['I took a shower last night and sat down in the tub to scrub my feet and legs, with my back facing the faucet.', ""I have gym class later, and I'll likely be feeling the strain when we do stretches.""]"
"['tried to make contact with me on the escalator.', 'i ignored her and didn’t even smile, acting like she wasn’t there.']","[""I turned a blind eye to her and refrained from even cracking a smile, pretending as if she didn't exist."", ""i’m mid-20s with a world of experience and relationships, and i don't believe in soul mates, but i felt something i never felt before.""]"
"[""i'm backing up and turning around, she shows up, i just happen to see her when she let's out her usual hound scream."", 'i get out to see if she and the sprinter our okay.']","['As I reverse and turn around, she appears out of nowhere and lets out her signature howl.', 'speed limit or just below.']"
"['now with these surveys i have always lied.', ""so far, i've received about $35 in play store credit by doing these surveys."", 'people who lie on their surveys.', 'google caught me lying and left me feeling like i lied to my own father.']","['after completing the surveys, you receive anywhere from $0.10 to $2.00 for doing a survey to use on the google play store.', 'if i had been honest, i would not have gotten any surveys much like when i told my friend about the app and never got a survey after his first one.', 'it was a 3 question survey.', 'google then proceeded to scold me saying lying is a bad thing and it will most likely not consider me for future surveys.']"
"['this time when i get no response i get frustrated and shout ""are you fucking deaf!""', 'and storm off to go find a seat somewhere else that\'s when im approached by someone else who was watching this and he comes real close to me and says ever so calmly...\n "" they are actually deaf..""  and right then i put it all together.. they were signing to each other in sign language.']","['so i approach one of the guys with his head turned to me and im like "" hey man what were you two just doing there with your hands?""', 'As I stormed off to find a different seat, someone else who had been watching the scene approached me and whispered calmly, ""They are actually deaf.""']"
"['i thought i would avoid a fight by just going along with his brilliant addendum of tipping the bed frame on its side instead of just moving it to the other side of the room.', 'my husband said ""it\'s the bed.']","['my husband is allergic to dust.', 'I believed that agreeing to his creative suggestion of tilting the bed frame on its side would help me avoid a confrontation, rather than simply moving it to the other side of the room.']"
"[""we're traveling and traveling and everything is pretty boring since they told us not to bring our phones ( but i did anyway livin teh tuhg life ) and as we're all bored as fuck, we see some other buses."", 'so this goes on for about fifteen more minutes and when one looks like they just got shot, someone says "" ian lick the window "" and of course being the dumbass i am, i did.']","['As the activity continues for approximately fifteen more minutes, someone remarks, ""Ian should lick the window,"" and, being my usual gullible self, I obediently comply.', ""until skip to now and i'm absolutely the sickest i've ever been, over the weekend i didn't really feel good, but now i feel destroyed.""]"
"['i grab half of the branch in my left hand and, in my rush, keep hold of the axe in my right.', 'i had slammed the knuckle of my left thumb directly into that razor sharp blade.']","['I grasp half of the branch with my left hand while maintaining my grip on the axe with my right hand, as I hurry along.', 'luckily it only took a few hours and five stitches but i learned (relearned?)']"
"['before eating, i took my retainer out and wrapped it in a napkin, then happily dug in.', 'i was just now preparing for bed, brushing my teeth, when i reached for my retainer and found it...gone!']","['by the time i finished my meal, i had forgotten about the retainer wrapped in napkin so i threw that into the box of leftover scraps, then chucked the box into my garbage.', 'I was getting ready for bed, brushing my teeth, when I realized that my retainer was nowhere to be found.']"
"['my girlfriend was over at my house and was on my computer so i decided to have some fun by using  an app that allows you to control your computer using your smartphone.. so i closed the page she was on a couple of times  and she freaked out and i just said it must have been her doing it.', 'she said she could never trust me again and refused to talk to me.']","['I decided to have some fun by using an app that allows me to control my computer with my smartphone while my girlfriend was visiting me at home.', 'She expressed that she would never be able to rely on me again and declined to engage in conversation with me.']"
"['well asoon as i asked him for a raise, he looked up at me, smiled and pulled out a stack of papers from his desk, now at this moment i thought he was gonna make me sign a contract for my new raise, but it wasnt a contract, it was a huge stack of job aplications from people looking for a job.', 'he looked me right in my eyeballs and said ""you know how many people are lined up to take your job"" immeadiately i turned around, grabbed my broom and walked right out happy i still have a job.']","['As soon as I requested a raise, my boss looked up at me with a smile and pulled out a large pile of papers from his desk.', 'I thought he was going to give me a new contract, but instead, it was a stack of job applications from people seeking employment.']"
"['they ran out the open door and the younger one started bawling.', 'about 10 minutes later of this, her council guy told me she tried to commit suicide earlier this year.']","['the older one came to me and told me i dont do shit while i was kneeding the dough for pretzels.', 'They sprinted out the open door, and the younger one burst into tears.']"
"['i flagged the bus down and thank god the bus driver stopped in the middle of the road to let me in.', ""lesson learned...don't get too friendly with random strangers at the bus stop in the middle of the night.""]","['he starts to get tired of waiting for me to end the call and closes his eyes.', 'I hailed the bus and thankfully, the driver stopped in the middle of the road to allow me to board.']"
"['so with my neighbor staring at me waiting for me to pick up the poo i crafted a ""snow poo sandwich"" to try and pick it up.', 'the snow melted and my hands were numb with logs of dog shit in them.']","['after sniffing around and not doing anything the entire block, we finally get close to my house and right as my neighbor pulls in his driveway my dog goes in his lawn to shit.', '""The snow melted, leaving my hands feeling numb and cold, with logs of something unidentifiable in them.""']"
"['it was halloween and i decided to wear a hot dog costume to school as many other kids dressed up as well.', 'and i was called wiener by almost everyone that i spoke to until the end of middle school which was 8th grade.']","['it barely caught on that day but which made my case worse was that during cross country practice, i had decided to wear my costume while running.', 'now i am a junior and high school and i realize that it was kind of fucked up that i was called wiener for so long and had no problem with it.']"
"[""my 5th period isn't the greatest."", 'subconsciously, i start putting it around my thumb finger nail, doubting it could puncture at all.', 'i for some reason press down on it and contrary to my belief, **it goes through.', '** at light speed i grab the staple and yank it out, and that causes the wound to get cut up even more.']","['My fifth period is not particularly outstanding.', 'I unconsciously began twirling it around my thumb and forefinger, questioning its ability to pierce the skin.', ""I pressed down on it despite my belief that it wouldn't work, and to my surprise, it went through.""]"
"['talking to one one of my criminal justice professors outside of class.', 'the conversation goes a little something like this:\nprof: ""i\'m lookin\' forward to watching you guys next season, hopefully you guys can turn it around!""']","['this happened 45 minutes ago, and i knew exactly where to come for my first post!', 'so students and teachers begin to develop a very close relationship.']"
"['as i was on one leg my opponent threw himself to the left to try and escape my move.', 'this means i will have to take make up exams after christmas break in january which sucks because i have to study during the break.']","['This implies that I will have to sit for makeup exams in January, after the Christmas break, which is frustrating because I will have to dedicate my holiday time to studying.', ""to top it all off i was supposed to go on a ski trip with my family, but that's most likely not happening now.""]"
"['i decided to speak to my uncle about it, to inform him to be aware of it when he was around his grandkids.', 'i felt like the victim all over again!', 'i have feared that he would do it again to someone else!', 'if you have ever been molested, please speak up and say something, no matter what it takes.']","['when it finally stopped, i never said another word about it and put it in the back of my mind to the point i forgot about it for years\ncue me having kids years later and when this person came around them, it came flooding back.', 'I chose to discuss the matter with my uncle, to bring him up to speed on it so he could be mindful of it when spending time with his grandchildren.', 'and if i had just had the balls to say something all those years ago, that i could have saved those 2 innocent kids.', 'It takes courage to speak up, but doing so can bring healing and justice.']"
"['i got through almost all of them, when i went to wipe the sweat off my face.', 'anyone who works with food already knows how this story goes before i even tell it.', 'to say the least, i was pretty much useless for the rest of my shift.', 'even after the pain stopped, my skin was still clearly red where the pepper juice touched my me.']","[""You'll no doubt be familiar with this tale if you're involved in the culinary world, as it's a story that's been told many times before."", 'it took about a minute for the bottom half of my face to start feeling like it was burning off.', 'it took 3 1/2 hours for the pain to become bearable.', 'After the pain from the pepper juice had subsided, my skin still appeared distinctly red where it had come into contact with the substance.']"
"['at the time there was this cut on my leg that had been bothering me, so i started to pick at it.', ""it wasn't like blood was pouring out of my but it was a lot for a small \ncut on my leg.""]","['after i had made lunch i became fidgety because i was not occupied with anything.', 'There was a significant amount of blood coming from a relatively small cut on my leg.']"
"['i heard a janitor coming by, and decided whatever, i just want the heat out.', 'and then he starts to fucking hit the floor with his feet so his sneakers make that high pitch squeaking sound, and i forgot my roommate is still sleeping, and apparently it startled him and woke him up.']","['I detected the sound of a janitor approaching and thought to myself, ""Oh well, I might as well turn up the heat since they\'re here anyway.""', '""He starts tapping his feet on the floor, causing his sneakers to make a high-pitched squeaking sound.']"
"['so one day i was with my friends and on carige walked by.', ""luckily my legs didn't break but i was unable to walk for 1-2 weeks.""]","['i was at my grandparents, and whenever a carige dragged by a horse was moving by every kid would hop to ride it, either on the side or sit on pipe that was hanging in the middle of it.', 'Fortunately, my legs were not injured seriously, but I was unable to walk for a period of 1-2 weeks.']"
"['this was five years ago ( im 18 now ), me and my girlfriend ere bored and my parents were not at home.', 'turned out i had to carry a bottle with me everywhere i had to piss as i couldnt control the piss coming out.']","['About five years ago, when I was 18 years old, my girlfriend and I were feeling bored and our parents were not present at home.', 'dumbfounded, i realise i couldnt remove my foreskin and cum yet.']"
"['like probably some other people also have dogs have the struggle that they get cocky when someone rings on the door.', 'basicly, forgot to lock my dog away, i accepted the package, my dog jumped the mail man and ran away downstairs \n\n(we live in new buildings / apartments or however u call it)\n\nwanted to catch my dog, forgot the keys for the door and got locked up outside my own apartement and needed to spend like 4 hours until my parents came back xp']","['Some individuals, like many others, may experience a common challenge when someone knocks on their door In essence, I forgot to secure my dog before accepting a package, which led to my dog attacking the mailman and running away downstairs.', 'As a result, I found myself locked out of my apartment with no keys, and had to wait for four hours until my parents returned.']"
"['i found my seat, grunted a hello to the cheery-looking french family sitting next to me/on my row, and settled in with noise-cancelling headphones and some music.', 'suddenly, to my horror, as i pulled off the noise-cancelling headphones the ""silent"" fart turned seat-shakingly loud.']","['I located my seat, offered a cheerful greeting to the friendly French family seated nearby, and prepared for the flight with my noise-cancelling headphones and a personal playlist.', 'As I removed my noise-cancelling headphones, the previously silent fart suddenly became deafeningly loud, causing my seat to vibrate violently.']"
"['one of the guys brought a plastic bottle for some reason and he was throwing it over the cubicles at people (he had long arms and could reach over the cubicle).', 'eventually the plastic bottle found its way to the gutter and came with the flow of water to my cubicle.', ""i wanted to kick the bottle along the gutter so it'd go to the cubicle next to me and i kicked it real hard out of anger and ended up cutting my toe against this sharp bit of tile on the edge of the gutter."", 'it was a deep cut and blood started flowing like a river.', 'after a few minutes my whole cubicle was full of blood, it looked like a murder scene :s the health teacher came and saw the scene and i thought he was going to faint.']","['The plastic bottle made its way to the gutter and was carried by the flow of water into my workspace.', 'this happened a few times and it kept bugging me because they wanted the bottle back and i just wanted to have my damn shower.', 'I aimed to propel the bottle down the gutter with force, hoping it would land near my neighboring cubicle, but my anger-fueled kick resulted in a painful collision with a sharp tile edge, causing me to cut my toe.', 'The wound was severe and copious amounts of blood gushed forth like a torrent.', 'Within a few minutes, my workspace was transformed into a gruesome crime scene, awash in blood.', 'The health teacher arrived and was met with the grisly sight, causing him to appear on the verge of fainting.']"
"['i just got up and it was around 6:00. that would make me late for work.', 'and parked cars on the left.', ""i'm late for work and just want to make the turn."", 'my car spun out.', 'the car was sliding.', 'the road is too wet and no magical abs can help me now.', 'the audi brake checked everyone on the main road just to pull into a preschool on the right.', 'mistake #4\ngot a colleague to pick me up and we went to do some work away from our actual work building (where i was meant to be).']","[""I'm running behind schedule and eager to make my way to work."", ""i jumped on my brakes but i wasn't stopping."", 'off to work (again).', 'mistake #3\napart from the obvious cosmetic damage, the car was fully functional.', 'my wheels still lost traction on this steep hill!', 'we ended up getting pulled over by the cops for driving a commonly stolen car with some panel damage on the door.']"
"['i live in an on campus house of 12 girls, all of which are devout catholics.', 'i decided it was too funny not to send to my sister as well, copied it to my clipboard, and sent it to her.']","['i decided to ask all of my residents as well, and so i copied the text, pasted it in the group chat, and hit send.', 'a few minutes later i get a text from one of my residents saying ""what\'s lsd mean??""']"
"[""well every day after school i go to the gym, so today as i walk i notice someone doing squats facing the wall, brilliant ass, so i sit down to start doing some curls, and every now and then i'd take a glance at the lady squatting."", 'get to school the next day, i am called to the office, my english teacher is sitting there in front of my principal and ensues the most embarrassing after school detention and explanation to my parents.']","['Every day after school, I make a point to visit the gym.', 'I was then subjected to an embarrassing after-school detention and a lengthy explanation to my parents.']"
"['i told her i deserved better than a text break up, she agreed.', 'i was raised by my father by the words, ""my word is my bond.""']","['I was brought up by my father with the mantra ""my word is my bond,"" which emphasized the importance of keeping one\'s promises and being true to one\'s word.', 'she then proceeded to tell me how awesome her life was going, and that she was doing well and she had found several people to fuck and she was happily in a causal relationship with one.']"
"['not just from rarely working out, one on my car as well.', 'i starting jacking up the car, and somehow i jacked off the car.']","['so i looked for a good spot and pulled off to the side of the road.', 'I began raising the car using a jack, but somehow I managed to dislodge the car from its position.']"
"[""as expected, it was a bot, but i'm bored and eating my lunch."", ""in one of my replies, i actually copied and pasted the bot's link back to the bot."", 'fast forward roughly and hour and i go on facebook and see a funny video my gf sent me.', 'so i went to send her my own funny link (as we do frequently) and i guess i never had the copy command down.']","['so i accept it just to ask who it is.', ""as stated above, i'm bored (i feel that is very important to my really stupid incident) and i looked into skype bots a bit."", ""In one of my previous responses, I actually reproduced the bot's URL back to the bot."", 'I regularly send her humorous links, but this time I accidentally failed to copy the link correctly.']"
"['just before i got on the plane, i had an english breakfast with a sizeable portion of beans, i ate the whole thing.', 'i will never had beans before getting on an air plane.']","['for the remainder of the four hour journey, i kept on going back to toilet to let it rip.', 'I have never eaten beans before boarding an airplane.']"
"['as i was filling up the tank, a guy came by with a gas container and asked if he could have some gas.', ""i'm a nice person so i said sure and let him pump some gas.""]","['While I was refueling my vehicle, a man approached me with a portable gas container and inquired if he could have some fuel.', 'I kindly agreed to let him fill up his gas tank, demonstrating my friendly demeanor.']"
"['whilst checking my email, i received an email from <event name> on how the afternoon workshops were rescheduled.', 'i will say that email was definitely not the way to go about this.']","[""you know when you write an email, write it, but don't send it because its overly harsh?"", 'During my email check, I found an email from <event name> regarding the rescheduling of the afternoon workshops.']"
"[""i'm on my laptop playing tera for about 2 hours now and i'm starting to feel very hungry because i didn't eat that much for dinner, so i'm like i'll just drink some milk than wander off to bed, so i reach the kitchen and open the fridge and i find no milk."", ""so i clean up the watermelon and wash off the dirt and clean the utensil and clean the floor which is uber sticky so i pack up everything and head off to bed, once i'm in bed i notice my leg is sticky and not the good sticky and my shorts are wet from all this watermelon juice.""]","[""I decide to quench my thirst with a glass of milk, but when I head to the kitchen and open the fridge, I'm dismayed to find that there's no milk left."", 'Once I was in bed, I realized my leg was sticky and my shorts were damp from all the watermelon juice.']"
"[""so.. ifub'd calling the place i used to work a year after quitting."", ""i reply and get the job, but at this point they don't even realize i'm interviewing to also get a full time job with them."", 'so it turns out this part time role and full time role were the same role.', 'i ask permission to call my old company and get the approval.', ""it turns out the two agencies are very competitive and have some inter-industry beef i didn't know about."", 'at the end of the first week they tell me i\'m not needed for the full 2 weeks because they ""overestimated"" how much work there was to do.']","['I respond to their offer and secure the position, but at this point, they are unaware that I am also interviewing for a full-time job with the company.', 'It turns out that the part-time position and the full-time position were actually the same job.', 'i realize that these are all the places i used to contact while working at the previous job for a bank client.', ""i don't have my notes from that job anymore, but this is a great opportunity to go above and beyond and get that list from my old company."", 'It appears that the two organizations have a history of competitiveness and some underlying tensions within their respective industries that I was not aware of.', 'After the first week, they informed me that I was not needed for the full two weeks because they had overestimated the amount of work available.']"
