Original,Paraphrased
"['in the middle of class, while panting on the sidelines, i hear one of the girls loudly whispering, ""she\'s a lesbian?!""', 'not only did she tell her homophobic friends, she participated in taunting me and humiliating me in a locker room full of girls.']","['at the end of class i walked into the locker room when i heard the trio behind me.', 'She not only revealed her biased views to her friends, but she also actively participated in mocking and embarrassing me in front of a group of girls in the locker room.']"
"['so various people in the upper school became party leaders and they all ran campaigns to get the students to vote for them.', 'so we wrote sheep on that poster and went off in high spirits.', 'we were to take down every single election poster.', ""we were pretty sure we'd got them all when we finally could take off our badges and return to being normal, non lib dem supporting eleven year olds.""]","['his last name was ""issa.""', 'issa sheep.', 'We affixed the word ""sheep"" to the poster and set off with elevated morale.', 'that was our mistake.']"
"['i would like to assume that i am just reading the text out of context but unfortunately he has a history of stepping out on the marriage with my mother.', 'it is quite easy to delete text now as to oppose to when i was younger and he would borrow my phone then hand it back with all my messages deleted.']","[""well that's not my mom's name, who was with us standing on the others side of the table."", 'Deleting text is now much simpler than it was in the past, when my younger counterpart would borrow my phone and return it with all my messages erased.']"
"['little did i know, but vacuums tend to give off a bit of heat, so by the time i unplugged the vacuum, the damage was done, and dog shit was heated into the carpet.', ""my father won't leave work for another hour, and i have no idea how to clean it out without wanting to vomit.""]","['i turned the corner and into our carpeted office, where i proceeded to vacuum up dog shit.', 'Unbeknownst to me, vacuum cleaners emit a moderate amount of heat, which in this case, unfortunately, caused the dog feces to become melted into the carpet before I had a chance to unplug the vacuum.']"
"['i let him know in a minute as i open a video on facebook.', ""it's not a tyre changing video, it's a girl making loud moans.""]","['I informed him that I would be with him shortly, as I opened a video on Facebook.', '""The video doesn\'t show someone changing a tire, but rather a person making loud groaning noises.""']"
"['i took one step out of the shower and slam!', 'right into the toilet, crushing the cistern, flooding the bathroom and causing what would eventually become very apparent bodily harm.']","['rather than put all my towels on the floor, i spread out the two towels in the room and proceeded to fetch a bag of kitty litter from the garage and pour it all over the bathroom floor.', 'the color of purple that dominated my knee and stomach was something out of a horror film, and what was worse, i could feel a huge knot forming on my stomach where the point of impact must have been.']"
"[""i carefully open my backpack looking for the snickers, this heavenly 'nougat topped with caramel and peanuts, enrobed in milk chocolate' bar which will make me forget the trauma that a lady nearly died sitting in front of me."", ""i'm double checking the smell on my fingers if i was right about the ice tea but the smell is becoming much more ammonium like as my hand is approaching my nose.""]","['she is trying some other mojo on that poor lady when the miracle happens and the dead resurrects as jesus promised.', ""i'm scolding myself in my head that i forgot again to properly close my ice tea bottle but that can't spoil my celebration.""]"
"['it held up well.', ""(evidently the grass didn't serve as much of a support.)."", ""i flew off the ramp, but my bike didn't come with me."", 'i tried to give a meek thumbs up while i looked up at the sky.']","['i was riding bikes with two of my friends.', 'i stuffed as much as i could under the wood to try to stabilize the foundation.', 'The grass provided limited support.', 'I soared off the ramp, but my bike remained on the ground.', 'I attempted to offer a subtle thumbs up while gazing up at the sky.']"
"['after a little bit, i had the ball and i was running so fast that i didn\'t notice the ""big"" kid and ran right into him.', 'i thought his fat would absorb me, but instead i bounced off of him at 99 mph into the basketball hoop pole and hit my head and knocked myself out.']","['i was with a group of like 5 people and one of them was a ""big"" kid.', 'I feared that his obesity would swallow me whole, but instead, I rebounded off him at an astonishing 99 miles per hour and crashed into the basketball hoop pole, causing my head to hit the ground and rendering me unconscious.']"
"[""when i get my compass, i power walk over to my canvas when i snag my foot on a students bag strap and that's where it happened."", '_not_ only that, but as i went down the needle pierced and cut through the canvas like butter.']","['i stacked it while holding the compass and the  needle pierced the canvas of the person who was in front of me.', 'if anything comes from this colossal fuck up is maybe a few people receive entertainment from it.']"
"['we left for the game and decided to take her car.', 'as she started going in reverse she hit the front corner of my car.', ""nobody was home, and we were on her parent's property so i didn't know what to do."", 'the husband began texting my mom in all caps.', 'he blamed the situation on me because i ""shouldn\'t have parked behind her,"" and how i ""did it on purpose,"" and how he thought ""crashes on private property are the fault of the trespasser.""', 'he refused to involve insurance.', 'he would send texts calling my mom a ""fucking bitch"" and exclaiming that i am irresponsible.', 'i felt really bad for my girlfriend.', 'if she was to take the fall, he wanted her to pay every penny instead of involving insurance.', ""it was expensive to get new parts + paint for the 98. despite their insurance help, they didn't pay a penny."", 'turns out she had been cheating for a while.', 'if she contacts me again, i will report it to the school or authorities.']","['this was a while back while she was still my girlfriend.', ""i had only been dating her for a few months and i was on her parent's good side."", 'As she reversed, her vehicle collided with the front corner of my car.', 'He held me responsible for the situation, claiming that I should not have parked behind her and that I intentionally caused the crash on private property, making me liable for the damage.', 'a police report was never made.', 'I was deeply concerned and empathetic towards my girlfriend.', ""that's just unreasonable."", ""The cost of acquiring new components and painting the 98 was steep, yet despite their insurance coverage, they didn't have to pay a single penny."", ""i don't respond to the things she sends me."", 'If she reaches out to me again, I will bring it to the attention of the school or law enforcement.']"
"['let me go ahead and try it.', 'but i went on my couch and decided to try it.. at first i was able to reach the tip, then farther and farther until i put almost all of it in my mouth.']","['I lay down on my couch and decided to give it a try.', 'the bad part was that leaving my own dick in my mouth without being able to move because of the painful cramps i just got caused me to start choking.']"
"[""my girlfriend isn't stupid, she's seen me use the xbox kinect to record things before and knows they're automatically shared with friends."", 'i text her saying ""i didn\'t record us have sex, the xbox can\'t even do that, i thought i was being hilarious as usual!""']","['My girlfriend is aware that I use the Xbox Kinect to record content and understands that these recordings are automatically shared with my friends.', ""I messaged her, joking that I didn't record our intimate moment because my Xbox couldn't handle such a feat, and I thought my humor was as usual, hilarious.""]"
"['so i arrive at her house, she makes me an awesome dinner and we open a bottle of wine... now here is where i fuck up...\n\nshe asks what to watch and she suggests die hard... now let me clarify, its christmas.', 'because i was too busy watching john mcclane be a fucking badass!!!!']","['a girl starts dancing with me... one thing leads to another and i get her number.', '""I was too engrossed in watching John McClane\'s impressive feats of bravery and skill.""']"
"[""they're basically solid i'm like hell yeah i'm ready i go off the ramp again pulling off the top i'm like 6 feet in the air over clearing the downhill landing so at this point i'm 7 or 8 feet off the ground landing flat my shocks go down 3/4 of the way and instantly recoil all that force back up."", 'i end up bouncing off the ground going over the bars landing directly on my left cheek sliding across the ground.']","['so happened over the weekend.', 'I bounced off the ground, cleared the bars, and landed on my left cheek, sliding across the ground.']"
"['at this point i only look at my friend and we give each other this sort-of smile, basically saying, welp, it ends here.', 'lemme look at the contacts of your phone"".']","[""so yesterday i was walking to a friend's house with another friend, let's call him john."", ""At this point, I exchange a knowing glance with my friend, and we both silently convey the message since i'm writing this, it's obvious i didn't get killed, and i wouldn't be writing this either if my friend had, too.""]"
"['in a final twitch, my leg made my entire body move forward, making me lose balance and knocking my head on the (marble) table, instantly creating a huge wound that started bleeding quickly.', 'never skip leg day, but never have 2 leg days in a row either.']","['In a sudden jolt, my leg convulsively thrust forward, causing my entire body to lurch forward, leading to a loss of balance and a painful collision with the marble table, resulting in a deep gash that began bleeding profusely.', 'Aim to prioritize leg exercises regularly, but avoid doing them consecutively for two days in a row.']"
"[""i pull out my rice cooker which, doesn't look similar to the one in the video; maybe that would have been my first clue but i digress and i press on."", ""the rice cooker is plugged in, but the lights aren't on and my cake is burnt at the bottom.""]","['I retrieve my rice cooker, which appears to be different from the one shown in the video.', 'The rice cooker is powered on, but the lighting is off and my cake is overcooked at the bottom.']"
"['we gather the materials, make the mix, cook it and burned it.', 'my hand suffered the most and the house was filled with smoke (wich i didn´t know if it was toxic or not).']","['a friend came with the idea of rockets : dude, i got this really cool project, we need household items and it´s going to be awesome!', ""My hand endured the brunt of the damage, and the air inside the house was thick with smoke, the toxicity of which I couldn't determine.""]"
"['i had no idea whatsoever what the time was when her pretty old grandfather got up of his bed.', 'in turned out it was around 4am and he just needed to pee and had nowhere to sleep afterwards.']","['i was pretending i am still asleep when he walked out of the room and immidiately got into his bed when he dissapeared.', 'It transpired that it was approximately 4am and he merely needed to urinate, but he had no place to rest afterward.']"
"['today was a normal day in my house.', 'in my mouth.', 'i spat what little i had in my mouth onto the floor, then booked it to the sink where i rinsed out the carton and my mouth to find dozens of ants.']","['Nothing out of the ordinary occurred in my home today.', 'i drank out of the carton, and had most of the apple juice out of it.', 'I coughed up what little I had in my mouth onto the floor, then quickly ran to the sink to rinse out the carton and my mouth, only to discover dozens of ants.', ""i'm going to be drinking bottled water for the next probably lifetime.""]"
"['long story short i was maybe 14-15 working at a pet kennel.', 'now, keep in mind that i’ve walked as many as 5 dogs at once and been able to efficiently get my shit done.', 'the leash whipped around my ankle and i went down.', 'and got ducking dragged around like a rag doll.', 'we had to cut the leash off my ankle and i had a deep scar for years after.']","['In brief, I was around 14-15 years old and working at a pet kennel.', 'at this particular time, the owner let her dogs out.', 'The leash suddenly wrapped around my ankle, causing me to lose my balance and fall to the ground.', 'We were forced to remove the leash from my ankle, leaving a long-lasting scar that took years to heal.']"
"['my body could just not hold it in any longer and my pants filled.', 'that was the longest conversation of my life when the cop finally came back and handed me my ticket while i was squirming in my seat and just needing to get to my office and change and clean myself.']","['i have about a 15 minute drive to work and normally i enjoy pooping on the clock after my first cup of coffee.', 'I endured the longest and most uncomfortable conversation of my life while waiting for the police officer to return and issue me a ticket, all the while fidgeting in my seat and eager to reach my office to change and freshen up.']"
"[""as i head in to the lab that day i'm confronted with chaos."", ""i like being independent and strong, and now ... now i'm an idiot who used a spinny chair as a ladder."", 'a crying idiot who used a spinny chair as a ladder.', ""all's well that ends well, as i'm working at the field site as a graduate student, though i turn pink whenever new students get a lab tour and are told where the ladders are located and that spinning chairs are not a good substitute.""]","['------------\n\none morning i was headed to the lab to dissect bees.', 'these chips were fairly expensive, and each bee needed to be kept and dissected to learn about its parasites.', 'i hit, something, with my head as i fall.', 'Everything turned out well, despite my embarrassment when new students visit the field site and I feel my face turn pink when they are shown where the ladders are and informed that spinning chairs are not a suitable substitute.']"
"['about last year i started to work on an old house my mother owned.', 'now my mother wants me to pay rent on it to her and does not want to pay me back because she does not think that it is fair.']","[""the fuck up happened last weekend when i was doing some landscaping in the back and my mom's partner lost her shit on me for getting rid of a tree."", 'My mother now expects me to pay rent on the item she bought for me and does not intend to reimburse me, as she believes it is unfair to do so.']"
"['or so i thought - found out this morning that the fuel gauge generously always reads between 1/2 and 3/4.', 'of course, i found this out a mile away from home, on an empty tank, while riding solo, and my phone is in the garage, at home.']","['I discovered this morning that the fuel gauge on my vehicle has a tendency to overestimate the amount of fuel remaining, consistently showing a level between 1/2 and 3/4.', 'now her car is stuck.']"
"['this happened on november 10, 2015.\n\ni went over to my friends house to celebrate the release of fallout 4. as we were waiting for the downloads to finish, we decided to go for a walk/hike.', 'my ego and adrenaline were raging so i instantly start my climb to the top.', 'this bent my wrist into a u shape and my ankle was more impacted than my doctors had ever seen.']","[""On November 10, 2015, I paid a visit to my friend's abode to commemorate the launch of Fallout 4."", 'during this hike i decided to climb a huge petrified tree, about the same height as the wall.', 'The device forced my wrist into a U-shape, causing more strain on my ankle than my doctors had ever observed.', 'as it is, i have a cast on my wrist, as well as my ankle along with an external fixator (metal bars going through the bones to reshape my soft tissues and bones).']"
"['for a reason only god knows at tbis point, i put my phone in my left pocket, and forgot to grab my wallet, as i was focused on work, and was not paying great attention.', 'i ran to the bathroom, saw my wallet, and opened it to see the cash was gone.']","['For reasons unknown to me at this time, I inadvertently placed my phone in my left pocket instead of my wallet, as I was deeply engaged in my work and not paying close attention.', 'I hastened to the bathroom, espied my wallet, and upon opening it, discovered that the cash was absent.']"
"[""so this happened about a month back, i'm at this mates 18th and one of the girls invited is this girl i used to have a massive thing for whom i'd fallen out with due to her sending me snapchats of her in only a bra and panties while asking very suggestive questions (while knowing that i used to have feelings for her) and then saying it was nothing, and only a bit of fun and then getting mad when a few weeks later i drunkenly told her just how not okay i was with that."", 'now there vomit all over my mates living room and i have alot of very pissed off friends all looking at me.']","[""About a month ago, I was at a friend's 18th birthday party where I ran into an ex-flame who I had strong feelings for in the past."", ""Now, there is a significant amount of vomit spread all over my friend's living room, and I have many angry friends who are all staring at me with disapproval.""]"
"['it all started by me saying i was going to clean his tank for the first time in months.', 'unfortunately, i did make my fiance and i late for our date, and we had to wait 90 minutes in line because of it...']","[""i don't wanna make a mess, so i head to the bathroom with his tank in one hand and the jar in another."", 'Regrettably, my fiancé and I were late for our date, which caused us to wait in line for 90 minutes.']"
"['regardless, i set off on my quest for beer money by traveling to a relatively close store that i have only worked in two other times in my four years as a tech.', 'my computer actually froze right after that!” and then was explained to that what i did broke the computers.']","['anyways, i was at my job as a pharmacy technician for a corporate pharmacy in a supermarket.', 'since i’m a college student and i’m not home 9 months out of the year, i travel around to other pharmacies within the companies for hours.']"
"['this is her story, i\'m just posting it for her (she\'s a lurker)\n\n> our 11 year old son had just read the xkcd comic titled ""one of the"" and as we started walking into a store he said to me, ""honestly, a \'one of the world\'s best moms\' mugs would be better because even if they\'re the sweetest mom in the world, they might still only be *one* of the best.""', '> i said, ""but i\'m still the world\'s best mom though, right?']","[""She is sharing her daughter's story on her behalf, as the daughter is a lurker (i.e., a silent reader) and not an active participant in the conversation."", '""I\'m confident that I\'m still the best mom in the world, don\'t you think?""']"
"['i pay my mom 150 a month for rent and my cell phone.', 'i should have just given her the cash.']","['so i pull my money out.', 'It would have been better if I had simply given her the money.']"
"['as always, this happened a couple of years ago, but was brought back to light by an askreddit thread.', ""me: we don't have fun dip, but we do have something similar called lip and dick lollipop (dip and lick lollipop)\n\nthe mom had over heard and tried to get me fired""]","[""kid:i'm looking for some fun dip, but i'm not seeing it."", '""We don\'t have fun dip, but we do have a similar treat called a lip and dick lollipop (which is a dip and lick lollipop).""']"
"[""i was babysitting and i had to use the bathroom, so i go in there and i remember noticing that the toilet bowl was a little more full than it probably should've been."", 'so now the sink is full.']","['While babysitting, I needed to use the bathroom and noticed that the toilet bowl was more full than it should have been.', 'i grabbed a cup from the counter and started scooping water out of the toilet and into the sink.']"
"['today i wake up at around 10, i make myself breakfast with the intention of going to the library after to study.', 'i mistakingly take the yawn pill instead of the rise, 20 mins later i realise my mistake and the effects and i try to fight it.']","['I inadvertently swallow the yawn pill instead of the energy booster, and 20 minutes later, I realize my mistake and feel the effects.', ""i try to keep myself awake for another 20 mins, but couldn't really focus so i decided to just give up.""]"
"['until i took a drink and felt a few very solid somethings go pop!', 'in my mouth, followed by an explosion of very disgusting grape flavor.']","['the lemonade had only been sitting out for 10 or so minutes untouched when i took another drink of it and noticed it tasted kind of... grapey.', 'A foul-tasting grape flavor assailed my taste buds, leaving a disagreeable aftertaste.']"
"['fast forward 90minutes of me panicking and looking for the cap, the brownies are good and cooled off so i serve them to kids and about 30 seconds later i hear a faint crunch and my 12 year old niece starts screaming hysterically and yelling that her tooth hurts, she spits into a napkin and i find my missing cap and a pretty good piece of her tooth.', 'her mom (my sister) took her to the dentist the first thing in the morning and we find out that er tooth was one of her ""adult"" teeth so pulling it was not an option so now my 12 year old niece need a cap on her tooth because of my cap.']","['Just over a minute later, my 12-year-old niece started screaming in pain and spat out a piece of tooth along with my missing cap.', ""My sister took my 12-year-old niece to the dentist early in the morning, and we discovered that one of her adult teeth needed a cap because it couldn't be pulled.""]"
"['this school year i have missed a lot of school i guess too much last week my counselors called me in and told me if i miss another day  i will lose credit for this semester (senior in highschool) so me being me woke up this morning and felt horrible throwing up the whole nine yards, i couldn’t go to school so i just slept in, i awoke to my mother screaming about how i just failed school i start freaking out and asking her how.', 'micheal m\ncredit loss\n\n\nstudent micheal m has missed the given absent days (10) and do to failure to appear we will be revoking this semesters credits.']","[""This semester, I've missed a significant amount of school, and my counselors recently warned me that if I miss another day, I'll lose credit for the semester."", 'Michael M has missed 10 days of class and as a result, we will be withholding credit for the current semester due to his failure to appear.']"
"['anyway, i was on my way home and was pretty bored after driving for sometime.', 'i was wondering what would happen if i tried braking with my left leg.']","['then out of pure boredom, this dumb idea strikes me.', 'I was curious about the outcome if I were to use my left leg to slow down or stop the vehicle.', 'instead i started braking even harder.']"
"[""i'm going 80 down the highway (i know it'll suck more gas but i'm the type of person to have no sense) i come over a hill, and get lit up."", ""the ticket sums up to\nconstruction zone - check\n\nalleged 80 in a 45. \n\n \n\np.s i'm having questions about the alleged 80 part, and how fast the court will presume i was going, and base my ticket.""]","['""The total amount of the ticket is equivalent to the cost of entering a construction zone, where the speed limit is strictly enforced.""', 'if anyone that knows legal theories on to help me out with the alleged 80 part on my ticket, i would appreciate it, also i would appreciate any redirects to a subreddit that can help me in my situation.']"
"['i being in a hurry to take a shower and go to bed quickly selected the first name i saw in my contacts, unfortunately it was not him.', ""luckily for me it was a very good friend but my attempts at warning them to ignore the message failed and i don't think i can ever look at them the same.""]","[""In my haste to take a shower and get to bed as soon as possible, I randomly picked the first name in my contact list, but unfortunately, it wasn't the person I was looking for."", 'Fortunately, it was a close friend who received the message, but my efforts to advise them to disregard it were unsuccessful, and I fear that our relationship has been irreparably damaged.']"
"['before college started, i met this really pretty girl and we started talking.', 'never really talked to a girl like her because she was out of my league in looks.', 'one night, i find out form her dorm floor mates that she had cheated on me with 10 guys in about 2 weeks.', 'the worst part, i lost my scholarship, mugshot got posted online, lost my job, and lost my friends.']","['she started asking a lot of me and i just thought it was normal because i was kind of blinded.', 'I learned from her dorm floor mates that she had been unfaithful to me, having engaged in sexual activities with ten different men over the course of two weeks.', 'at this point i was pretty mad.', 'The most devastating aspect of this situation is that I not only lost my scholarship, but my mugshot was also posted online, resulting in me losing my job and my friends.']"
